{
  "$schema": "./schemas/version-manifest.schema.json",
  "version": "3.0.0-alpha.1",
  "codename": "Design Intelligence",
  "release_channel": "alpha",
  "packages": {
    "@omid-io/tokens": "3.0.0-alpha.1",
    "vibe-ui-vscode": "3.0.0-alpha.1",
    "vibe-ui-nextjs-starter": "3.0.0-alpha.1"
  },
  "schemas": {
    "intent_contract": "v1",
    "decision_contract": "v1",
    "design_genome": "v1",
    "design_contract": "v1",
    "critic_report": "v1",
    "verification_report": "v1",
    "design_spec": "v1"
  },
  "compatibility": {
    "node": ">=20.0.0",
    "python": ">=3.10.0",
    "nextjs": ">=15.0.0",
    "react": ">=19.0.0"
  },
  "last_updated": "2026-09-03"
}
